{"day":"2026-01-01","format":"ledger-tagesblaetter/1","leaves":[["1e5fbe9853522662f2fea962e6ca6893d825da1d8096a69d7237e85e5b498617","c549809bd9ab5ba2c4c5e70d2052961dfd0ec224e5ae6c7c74d3f3bab23d4a42"],["2d92cc232ee3732c0d395e8cc32f5b1026f396de227190f940e42b453cf88f7c","606ea38eb4866d33dc28409221cc5131240b31f69333f925507393a4f3bbda5a"],["6a67ff9572b4d663920a2e740361b09ee2cb6acae8ecf613e6a30b16aad350f9","27f678c7c3c9f763cb99aa6bfb4715d4667faa4b0d6c9f8a2e36e20250b4233c"],["b1ed9cae78dcfafe822b101de7ce470c80f85b3838f7d2701da3de2b588e2c04","b48375ab1d0a8b4e54d42d8a7c6239eea5ebac215b1b07f45cf8f912030bb2ea"],["b579b898d722778e7776c38f5dc949ad5a516600bf3f6191dc19d156b6b614c9","422e6e14cdbcb279e6970d8c3116968be422865376c874ede422aa127418da36"]],"log_id":"ledger-testprotokoll-1"}
